{
  "additionalProperties": false,
  "properties": {
    "change_id": {
      "title": "Change Id",
      "type": "string"
    },
    "change_type": {
      "title": "Change Type",
      "type": "string"
    },
    "target_id": {
      "title": "Target Id",
      "type": "string"
    },
    "before": {
      "additionalProperties": true,
      "title": "Before",
      "type": "object"
    },
    "after": {
      "additionalProperties": true,
      "title": "After",
      "type": "object"
    },
    "requested_at": {
      "anyOf": [
        {
          "type": "string"
        },
        {
          "type": "null"
        }
      ],
      "default": null,
      "title": "Requested At"
    },
    "decision": {
      "default": "needs_review",
      "title": "Decision",
      "type": "string"
    },
    "reviewer": {
      "anyOf": [
        {
          "type": "string"
        },
        {
          "type": "null"
        }
      ],
      "default": null,
      "title": "Reviewer"
    },
    "approved_at": {
      "anyOf": [
        {
          "type": "string"
        },
        {
          "type": "null"
        }
      ],
      "default": null,
      "title": "Approved At"
    },
    "approval_id": {
      "anyOf": [
        {
          "type": "string"
        },
        {
          "type": "null"
        }
      ],
      "default": null,
      "title": "Approval Id"
    },
    "target_path": {
      "anyOf": [
        {
          "type": "string"
        },
        {
          "type": "null"
        }
      ],
      "default": null,
      "title": "Target Path"
    },
    "target_hash": {
      "anyOf": [
        {
          "type": "string"
        },
        {
          "type": "null"
        }
      ],
      "default": null,
      "title": "Target Hash"
    },
    "evidence_ids": {
      "items": {
        "type": "string"
      },
      "title": "Evidence Ids",
      "type": "array"
    },
    "status": {
      "default": "needs_review",
      "title": "Status",
      "type": "string"
    },
    "notes": {
      "anyOf": [
        {
          "type": "string"
        },
        {
          "type": "null"
        }
      ],
      "default": null,
      "title": "Notes"
    },
    "risk_flags": {
      "items": {
        "type": "string"
      },
      "title": "Risk Flags",
      "type": "array"
    }
  },
  "required": [
    "change_id",
    "change_type",
    "target_id"
  ],
  "title": "AdminChangeRecord",
  "type": "object",
  "$schema": "https://json-schema.org/draft/2020-12/schema"
}
